{
  "schema_version": "1.0",
  "case_id": "synthetic-case",
  "snapshot": "vulnerable",
  "condition": "baseline",
  "repetition": 1,
  "request_id": "synthetic-request",
  "run_id": "run-synthetic-one",
  "source_commit": "bbbbbbbbbbbbbbbbbbbbbbbbbbbbbbbbbbbbbbbb",
  "worktree_digest": "sha256:aaaaaaaaaaaaaaaaaaaaaaaaaaaaaaaaaaaaaaaaaaaaaaaaaaaaaaaaaaaaaaaa",
  "bundle_entries": [
    {
      "path": "src/example.py",
      "byte_count": 100,
      "token_count": 25,
      "content_digest": "sha256:bbbbbbbbbbbbbbbbbbbbbbbbbbbbbbbbbbbbbbbbbbbbbbbbbbbbbbbbbbbbbbbb",
      "truncated": false,
      "selection_reason": "synthetic include"
    }
  ],
  "prompt_template": {
    "name": "baseline",
    "version": "1.0",
    "digest": "sha256:cccccccccccccccccccccccccccccccccccccccccccccccccccccccccccccccc"
  },
  "profile_template": {
    "name": "none",
    "version": "1.0",
    "digest": "sha256:dddddddddddddddddddddddddddddddddddddddddddddddddddddddddddddddd"
  },
  "reviewer_config": {
    "model": "synthetic-model",
    "tool_policy": "read-only",
    "input_token_limit": 4000,
    "output_token_limit": 1000,
    "temperature": 0,
    "adapter_version": "1.0"
  },
  "request_digest": "sha256:eeeeeeeeeeeeeeeeeeeeeeeeeeeeeeeeeeeeeeeeeeeeeeeeeeeeeeeeeeeeeeee",
  "leakage": {"policy_version": "1.0", "passed": true, "rule_ids": []},
  "created_at": "2026-01-01T00:00:00Z",
  "content_digest": "sha256:aa221a375f2de2bd3a6e7ecc3682904d342c5550d2977941e52007b846737218"
}
